Kata / Kalimat,Sentimen Data Asli,Sentimen Data Prediksi
alhamdhlillah laju garuda indonesia gila beda level banget tim nasional bingung bagus banget enak tonton,negatif,negatif
motm indonesia vs uzbekistan,positif,positif
main jelek indonesia hujat wasit,negatif,negatif
tim nasional lolos semi final amp bikin masyarakat indonesia full senyum free alias gratis kelas ada main tim nasional piala asia semangat garuda olimpiade tinggal selang,negatif,positif
kecewa hormat putus wasit,negatif,negatif
ditunggutunggu zahra muzdalifah main babak,negatif,negatif
aneh main uzb bentur witan anggap langgar kocak banget wasit sogok kelas afc pakai wasit model wasit liga tarkam,negatif,negatif
saddil sensitif ong kim swee diskusi saddil ramdani anak asuh sabah fc panggil tim nasional indonesia,negatif,negatif
p maljum tau butuh gigolo dm ya khusus bandung ayoooooo,negatif,negatif
sahabat habis nonton indonesia vs guinea coba ngumpul,negatif,positif
indonesia menang level dunia,negatif,negatif
latih lempar motor latih pas nobar gara gara wasit biadap latih arghhhhhhhhgggg,negatif,positif
gweh cinta banget si hubner jiwa preman gavi takuttakutnya,positif,positif
indonesian abroad ft sabah fc nang fc main indonesia saddil ramdani tampil penuh sayang gagal bawa tim dulang poin pekan perdana djarum,negatif,negatif
wts skiv rou lafiye all warna gercepp yaaw,positif,positif
pa juang pelan naik level main proses berprogress penting jalan timnasday,negatif,positif
shin taeyong slot main kualifikasi piala dunia kan manggil malik risaldi kah latih nih ganti witan ibadah haji,positif,positif
main tim nasional offside nyentuh bola nyentuh bola umpan pendek pas woy wasit china dasar kontol jongos china abdi uzbek,negatif,negatif
negara butuh orang jujur ayo revisi uu jaksa,positif,positif
balas liga dangdut,negatif,negatif
klub orang indonesia promosi serie a struick bintang asia,positif,positif
segi tahan serang ber tubi jam tahan tiang juang terimakasih bangga,negatif,positif
lepas wasit kontroversial poin bikin indonesia kalah lawan uzbek fisik mental skill individu main bawah main uzbek beda nya banget duel,negatif,negatif
naik harga tiket tim nasional indonesia persen,positif,positif
daftar sejarah juara rekor juara edisi kali jepang kali iraq kali uzbekistan kali korea selatan kali arab saudi,negatif,positif
nonton konser musik harga tiket juta keluh nonton tim nasional main harga tiket ratus ribuk ribut model masyarakat sih,positif,positif
hmi blumm nih,positif,positif
tau kerja tum pssi erick thohir adira finance,positif,negatif
capek banget habis nonton drama korea tembus pagi tidurz korsel emang the best drama korea,negatif,negatif
mumpung suasana lebaran tolong ingfokan akun ig wasit tugas,negatif,negatif
ernando nya pakai baju dibu martinez pas main lawan argentina joget joget,positif,negatif
full indonesia uzbek gagal lolos final indonesia juang rebut posisi,negatif,negatif
atur ekspektasi nya guys tim debut uzbek final hasil sistem sepakbola jalan hasil quick fix hasil yuk tuntas olimpiade paris,positif,positif
yah kalah lemes sih apa tarung semifinal sejarah sendiri semangat tarung rebut tiket olimpiade tim nasional indonesia,negatif,negatif
era digital kurang cari lemah orang muncul darimana lemah,negatif,positif
emang wasit bangsat tai babi,negatif,negatif
wts tiket indonesia vs philipina harga dm terimakasih,positif,positif
drakor negeri atlet pas final ngelawan negara amp bahkana sahabat hari ini shin tae yong did it,positif,positif
liatt bjirr main liga pakkk ayolahhh oyyy,positif,negatif
game rekomendasi weekend auto ledak jay idzes djarum babymonster in tokyo d princess,negatif,positif
nih sebar dana kaget nih yuk sikat layang paham ya ges tambah idr untung dm twitter,positif,positif
lanjur lanjur,negatif,positif
rela marathon drakor nonton tim nasional subuh sia sia hasil masuk semi final,negatif,positif
telat bela venezia final playoff promosi serie a shin taeyong pasti jay idzes tampil lawan irak good luck idzes lagi di jalan serie a,positif,positif
the real jumat berkah param indonesia v kore,positif,positif
aneh sih kalok ngehujat arhan lepas emang bikin own goal turut match arhan perform loh,negatif,positif
match indonesia vs uzbekistan,positif,positif
lihat main cadang fulham,positif,positif
jerman dipulangin korea,positif,positif
yuk beib main main stasiunplay akuh taut join,positif,positif
shen yinhao arhan struick offiside anda ongoal gol ferarri sah ya cerita tanding,positif,negatif
full senyum,positif,positif
shin taeyong misi tembus fifa tim nasional indonesia berat tarung vs irak filipina bukti,negatif,positif
jaksa peran,positif,positif
coba orang pasuk sukses banget ya semangat bangga maju,positif,positif
nyari tiket tim nasional indonesia vs filipina cat upper garuda yoo harga kotak masuk,negatif,negatif
saksi tanding langsung,positif,positif
mimin paham kecewa indonesia gagal lolos olimpiade wasit bikin darah plissss mari dewasa ras biar ras warna sepak bola stop rasisme,negatif,positif
final indonesia stadion isi nya jangkrik,negatif,positif
nanti panjang,positif,negatif
arah main mana,negatif,negatif
champions selamat manchester city hasil menang gelar liga inggris empat kali berturutturut taut,positif,positif
bersihbersih,positif,positif
indonesia serasa maroko piala dunia l,negatif,negatif
tidak apa good game peduli indonesia jerome polin taeeeeee,positif,positif
alhamdulillah tim nasional menang,positif,positif
gol korut goal of the tournament tuh,positif,positif
skuad garuda uji coba hadap tanzania kualifikasi piala dunia,positif,positif
yu yu yu revisi uu jaksa,positif,positif
erick bicara,positif,positif
momen tim nasional sulit menang gelora bung karno,negatif,positif
depan,positif,positif
hayo loh jagung,positif,positif
erick thohir tolong telepon argentina rematch,negatif,negatif
nya nonton banget guee kampung gbkeh demu yee rafael,positif,positif
rejeki main olimpiade rejeki tim nasional nnti lolos kualifikasi pildun weh,positif,positif
tutup botol ah ajg tidur aja,negatif,positif
harga untk semgad,positif,positif
apresiasi dukung temanteman jelang subuh salut,positif,positif
mari lurus,positif,positif
terima kasih sty,positif,positif
clearance krusial nastasia suci,positif,positif
wasit shibal sekiya,negatif,positif
saksi tanding fulham vs manchester city klik taut bawah epy kusnandar vina fulham jay idzes djarum aaliyah ras,positif,positif
bang jay main laga indonesia vs irak jadwal venezia fc playoff promosi serie a mepet,positif,positif
kemaren rafael maju capek ulang komen mana jelasin posisi rafael,positif,positif
ayo bicara,positif,positif
tum pssi erick thohir sambut antusias salah program unggul presiden amp wakil presiden pilih prabowo subianto gibran rakabuming raka makan gizi gratis anakanak indonesia,positif,positif
statistik yuk yuk finishingnya tajam semifinal terima kasih adik especially rafael n ernando,positif,positif
semifinal,positif,positif
var offside om wasit sudut kamera sejajar main cari angle kamera offside pro emang nih panitia afc bener kata latih justin but ucap selamat uzbek see next game,positif,positif
t emang stigma bikin gaduh ya,positif,positif
tim nasional indonesia untung wasit,negatif,negatif
indosiar tolong recruit tuh main uzb,negatif,negatif
tanding sf malam uzvarkistan semangat,positif,positif
jantung aman,positif,positif
